{
  "number": "+639190596629",
  "categories": [
    "robocall"
  ],
  "status": "reported",
  "riskLevel": "medium",
  "verdict": "warn",
  "firstReportedAt": "2026-07-31",
  "lastReportedAt": "2026-07-31",
  "reportCount": 1,
  "references": [
    {
      "type": "github-issue",
      "id": 5
    }
  ],
  "notes": "Community report of a potential automated, robocall, or marketing contact."
}
