{
  "number": "+639687391944",
  "categories": [
    "spam"
  ],
  "status": "reported",
  "riskLevel": "medium",
  "verdict": "warn",
  "firstReportedAt": "2026-07-31",
  "lastReportedAt": "2026-07-31",
  "reportCount": 1,
  "references": [
    {
      "type": "github-issue",
      "id": 6
    }
  ],
  "notes": "Community report of unsolicited spam information sent by SMS."
}
