{
  "number": "+639475606834",
  "categories": [
    "spam"
  ],
  "status": "reported",
  "riskLevel": "medium",
  "verdict": "warn",
  "firstReportedAt": "2026-08-18",
  "lastReportedAt": "2026-08-19",
  "reportCount": 1,
  "references": [
    {
      "type": "github-issue",
      "id": 22
    }
  ],
  "notes": "Community report of a phone call flagged by the caller app as suspected spam."
}
