{
  "number": "+639190573664",
  "categories": [
    "spam"
  ],
  "status": "reported",
  "riskLevel": "medium",
  "verdict": "warn",
  "firstReportedAt": "2026-07-31",
  "lastReportedAt": "2026-07-31",
  "reportCount": 1,
  "references": [
    {
      "type": "github-issue",
      "id": 12
    }
  ],
  "notes": "Community report of a suspected spam call that ended immediately after answering."
}
